{"schema_version":1,"bank_version":"v1","surface":{"id":30,"key":"roles","name":"Roles & Capabilities"},"snapshot":{"date":"2026-09-12","native_sources":[{"name":"WordPress Roles and Capabilities","type":"wordpress_handbook","url":"https://developer.wordpress.org/plugins/users/roles-and-capabilities/","verified":true},{"name":"WP_Roles","type":"wordpress_core","url":"https://developer.wordpress.org/reference/classes/wp_roles/","verified":true},{"name":"WP_Role","type":"wordpress_core","url":"https://developer.wordpress.org/reference/classes/wp_role/","verified":true},{"name":"WP_User","type":"wordpress_core","url":"https://developer.wordpress.org/reference/classes/wp_user/","verified":true},{"name":"map_meta_cap()","type":"wordpress_core","url":"https://developer.wordpress.org/reference/functions/map_meta_cap/","verified":true},{"name":"is_super_admin()","type":"wordpress_core","url":"https://developer.wordpress.org/reference/functions/is_super_admin/","verified":true},{"name":"get_editable_roles()","type":"wordpress_core","url":"https://developer.wordpress.org/reference/functions/get_editable_roles/","verified":true}],"market_sources":[{"name":"User Role Editor","type":"official_competitor","url":"https://www.role-editor.com/documentation/","verified":true},{"name":"PublishPress Capabilities","type":"official_competitor","url":"https://publishpress.com/capabilities/","verified":true},{"name":"Members","type":"official_provider","url":"https://wordpress.org/plugins/members/","verified":true},{"name":"MemberPress User Roles","type":"official_provider","url":"https://memberpress.com/docs/wordpress-user-roles/","verified":true}]},"status":"BANK_CLASSIFIED","records":[{"id":"roles.user.multiple_roles","feature_group":"User Assignment","option_path":"user.multiple_roles","label":"Multiple Roles per User","classification":"SOFT_NATIVE","hard_soft":"HARD","horizon":"CURRENT_NATIVE","adoption":"MUST_HAVE","priority":"P0_NATIVE","native_source":{"api":"WP_User::add_role","key":"roles","internal":false}},{"id":"roles.user.individual_caps","feature_group":"User Assignment","option_path":"user.individual_caps","label":"Individual User Capability Overrides","classification":"SOFT_NATIVE","hard_soft":"HARD","horizon":"CURRENT_NATIVE","adoption":"MUST_HAVE","priority":"P0_NATIVE"},{"id":"roles.assignment.individual","feature_group":"User Assignment","option_path":"assignment.individual","label":"Assign Role to Individual User","classification":"NATIVE_HARD","hard_soft":"HARD","horizon":"CURRENT_NATIVE","adoption":"MUST_HAVE","priority":"P0_NATIVE"},{"id":"roles.assignment.bulk","feature_group":"User Assignment","option_path":"assignment.bulk","label":"Bulk Role Assignment","classification":"WPE_HARD","hard_soft":"HARD","horizon":"CURRENT_MARKET","adoption":"PARITY","priority":"P0_PARITY"},{"id":"roles.assignment.remove","feature_group":"User Assignment","option_path":"assignment.remove","label":"Remove Role from User","classification":"NATIVE_HARD","hard_soft":"HARD","horizon":"CURRENT_NATIVE","adoption":"MUST_HAVE","priority":"P0_NATIVE"},{"id":"roles.assignment.replace","feature_group":"User Assignment","option_path":"assignment.replace","label":"Replace User Roles","classification":"NATIVE_HARD","hard_soft":"HARD","horizon":"CURRENT_NATIVE","adoption":"MUST_HAVE","priority":"P0_NATIVE","native_source":{"api":"WP_User::set_role","key":"role","internal":false}},{"id":"roles.assignment.filter","feature_group":"User Assignment","option_path":"assignment.filter","label":"Filter Users by Role","classification":"WPE_HARD","hard_soft":"SOFT","horizon":"CURRENT_MARKET","adoption":"PARITY","priority":"P0_PARITY"},{"id":"roles.assignment.affected_count","feature_group":"User Assignment","option_path":"assignment.affected_count","label":"Affected User Count Preview","classification":"WPE_HARD","hard_soft":"SOFT","horizon":"CURRENT_MARKET","adoption":"PARITY","priority":"P0_PARITY"},{"id":"roles.assignment.audit_ref","feature_group":"User Assignment","option_path":"assignment.audit_ref","label":"Assignment Audit Reference","classification":"WPE_HARD","hard_soft":"SOFT","horizon":"CURRENT_MARKET","adoption":"COMPETITIVE","priority":"P2_COMPETITIVE"},{"id":"roles.safety.admin_recovery","feature_group":"Safety","option_path":"safety.admin_recovery","label":"Administrator Recovery Path","classification":"WPE_HARD","hard_soft":"HARD","horizon":"CURRENT_MARKET","adoption":"PARITY","priority":"P0_PARITY"},{"id":"roles.safety.current_admin_lockout","feature_group":"Safety","option_path":"safety.current_admin_lockout","label":"Current Administrator Lockout Prevention","classification":"WPE_HARD","hard_soft":"HARD","horizon":"CURRENT_MARKET","adoption":"PARITY","priority":"P0_PARITY"},{"id":"roles.safety.target_role_policy","feature_group":"Safety","option_path":"safety.target_role_policy","label":"Target Role Edit/Assignment Policy","classification":"SOFT_NATIVE","hard_soft":"HARD","horizon":"CURRENT_NATIVE","adoption":"MUST_HAVE","priority":"P0_NATIVE"},{"id":"roles.safety.super_admin","feature_group":"Multisite & Network","option_path":"safety.super_admin","label":"Super Admin Special Authority","classification":"SOFT_NATIVE","hard_soft":"HARD","horizon":"CURRENT_NATIVE","adoption":"MUST_HAVE","priority":"P0_NATIVE","native_source":{"api":"is_super_admin","key":"network_admin","internal":false}},{"id":"roles.multisite.site_roles","feature_group":"Multisite & Network","option_path":"multisite.site_roles","label":"Site-Scoped Roles Context","classification":"SOFT_NATIVE","hard_soft":"HARD","horizon":"CURRENT_NATIVE","adoption":"MUST_HAVE","priority":"P0_NATIVE"},{"id":"roles.multisite.network_context","feature_group":"Multisite & Network","option_path":"multisite.network_context","label":"Network Context / Site Switching Boundary","classification":"WPE_HARD","hard_soft":"HARD","horizon":"CURRENT_MARKET","adoption":"PARITY","priority":"P0_PARITY"},{"id":"roles.diagnostics.permission_simulator","feature_group":"Diagnostics","option_path":"diagnostics.permission_simulator","label":"Permission Simulator (No Impersonation)","classification":"WPE_HARD","hard_soft":"HARD","horizon":"CURRENT_MARKET","adoption":"PARITY","priority":"P0_PARITY"},{"id":"roles.diagnostics.effective_explain","feature_group":"Diagnostics","option_path":"diagnostics.effective_explain","label":"Effective Capability Explain","classification":"WPE_HARD","hard_soft":"HARD","horizon":"CURRENT_MARKET","adoption":"COMPETITIVE","priority":"P2_COMPETITIVE"},{"id":"roles.diagnostics.role_impact_query","feature_group":"Diagnostics","option_path":"diagnostics.role_impact_query","label":"Role Impact Query","classification":"WPE_HARD","hard_soft":"HARD","horizon":"CURRENT_MARKET","adoption":"COMPETITIVE","priority":"P2_COMPETITIVE"},{"id":"roles.diagnostics.caveats","feature_group":"Diagnostics","option_path":"diagnostics.caveats","label":"Authorization Caveats / Dynamic Filter Disclosure","classification":"WPE_HARD","hard_soft":"SOFT","horizon":"CURRENT_MARKET","adoption":"COMPETITIVE","priority":"P2_COMPETITIVE"}],"coverage":{"records":19,"unreviewed":0,"adopted_or_classified":19,"notes":"User-role assignment, anti-lockout, multisite and diagnostics candidates."}}