{"schema_version":1,"bank_version":"v1","surface":{"id":4,"key":"relations","name":"Relations"},"snapshot":{"date":"2026-09-01","native_sources":[{"name":"WordPress Object-Term Relationships","type":"wordpress_core","url":"https://developer.wordpress.org/reference/functions/wp_set_object_terms/","verified":true},{"name":"WordPress Post Parent Hierarchy","type":"wordpress_core","url":"https://developer.wordpress.org/reference/functions/get_post_parent/","verified":true}],"market_sources":[{"name":"JetEngine Relations","type":"official_competitor","url":"https://crocoblock.com/knowledge-base/features/relations-overview/","verified":true},{"name":"Meta Box Relationships","type":"official_competitor","url":"https://docs.metabox.io/extensions/mb-relationships/","verified":true},{"name":"ACF Bidirectional Relationships","type":"official_competitor","url":"https://www.advancedcustomfields.com/resources/bidirectional-relationships/","verified":true},{"name":"Pods Relationship Field","type":"official_competitor","url":"https://docs.pods.io/fields/relationship/","verified":true},{"name":"Toolset Post Relationships","type":"official_competitor","url":"https://toolset.com/glossary/post-relationships/","verified":true},{"name":"ACPT Relational Field","type":"official_competitor","url":"https://docs.acpt.io/meta-fields/field-types/relational-field","verified":true}]},"status":"BANK_SURFACE_SEEDED","records":[{"id":"relations.frontend.form_disconnect","feature_group":"Frontend","option_path":"frontend.form_disconnect","label":"Frontend Form Disconnect Operation","classification":"WPE_HARD","hard_soft":"HARD","horizon":"CURRENT_MARKET","adoption":"COMPETITIVE","priority":"P2_COMPETITIVE"},{"id":"relations.frontend.listings","feature_group":"Compatibility","option_path":"frontend.listings","label":"Listings / Dynamic-content Integration","classification":"COMPATIBILITY","hard_soft":"HARD","horizon":"CURRENT_MARKET","adoption":"COMPETITIVE","priority":"P2_COMPETITIVE"},{"id":"relations.admin_columns","feature_group":"Compatibility","option_path":"admin_columns.enabled","label":"Admin Columns Relation Integration","classification":"COMPATIBILITY","hard_soft":"HARD","horizon":"CURRENT_MARKET","adoption":"COMPETITIVE","priority":"P2_COMPETITIVE"},{"id":"relations.import_export.definition","feature_group":"Portability","option_path":"portability.definition","label":"Export / Import Relation Definition","classification":"WPE_HARD","hard_soft":"HARD","horizon":"CURRENT_MARKET","adoption":"PARITY","priority":"P0_PARITY"},{"id":"relations.import_export.edges","feature_group":"Portability","option_path":"portability.edges","label":"Export / Import Relation Edges","classification":"WPE_HARD","hard_soft":"HARD","horizon":"CURRENT_MARKET","adoption":"COMPETITIVE","priority":"P2_COMPETITIVE"},{"id":"relations.import_export.pivot","feature_group":"Portability","option_path":"portability.pivot","label":"Export / Import Pivot Metadata","classification":"WPE_HARD","hard_soft":"HARD","horizon":"CURRENT_MARKET","adoption":"COMPETITIVE","priority":"P2_COMPETITIVE"},{"id":"relations.import_export.id_remap","feature_group":"Migration","option_path":"portability.id_remap","label":"Imported Object ID Remapping","classification":"WPE_EXCEED","hard_soft":"HARD","horizon":"WPE_FUTURE","adoption":"WPE_EXCEED","priority":"P1_EXCEED"},{"id":"relations.migration.provider_import","feature_group":"Migration","option_path":"migration.provider_import","label":"Competitor Relation Import Adapter","classification":"COMPATIBILITY","hard_soft":"HARD","horizon":"CURRENT_MARKET","adoption":"COMPETITIVE","priority":"P2_COMPETITIVE"},{"id":"relations.migration.storage_move","feature_group":"Migration","option_path":"migration.storage_move","label":"Relation Storage Migration","classification":"WPE_EXCEED","hard_soft":"HYBRID","horizon":"WPE_FUTURE","adoption":"WPE_EXCEED","priority":"P1_EXCEED"},{"id":"relations.migration.preview","feature_group":"Migration","option_path":"migration.preview","label":"Relation Migration Preview","classification":"WPE_EXCEED","hard_soft":"HARD","horizon":"WPE_FUTURE","adoption":"WPE_EXCEED","priority":"P1_EXCEED"},{"id":"relations.migration.rollback","feature_group":"Migration","option_path":"migration.rollback","label":"Relation Migration Rollback Snapshot","classification":"WPE_EXCEED","hard_soft":"HARD","horizon":"WPE_FUTURE","adoption":"WPE_EXCEED","priority":"P1_EXCEED"},{"id":"relations.performance.edge_limit","feature_group":"Performance","option_path":"performance.edge_limit","label":"Per-relation Edge Safety Limit","classification":"WPE_EXCEED","hard_soft":"HARD","horizon":"WPE_FUTURE","adoption":"WPE_EXCEED","priority":"P1_EXCEED"},{"id":"relations.performance.query_budget","feature_group":"Performance","option_path":"performance.query_budget","label":"Relation Query Budget","classification":"WPE_EXCEED","hard_soft":"HARD","horizon":"WPE_FUTURE","adoption":"WPE_EXCEED","priority":"P1_EXCEED"},{"id":"relations.performance.bulk_batch_size","feature_group":"Performance","option_path":"performance.bulk_batch_size","label":"Bulk Operation Batch Size","classification":"WPE_EXCEED","hard_soft":"HARD","horizon":"WPE_FUTURE","adoption":"WPE_EXCEED","priority":"P1_EXCEED"},{"id":"relations.performance.index_health","feature_group":"Performance","option_path":"performance.index_health","label":"Relation Index Health Diagnostic","classification":"WPE_EXCEED","hard_soft":"HARD","horizon":"WPE_FUTURE","adoption":"WPE_EXCEED","priority":"P1_EXCEED"},{"id":"relations.integrity.cardinality_validation","feature_group":"Integrity","option_path":"integrity.cardinality_validation","label":"Server-authoritative Cardinality Validation","classification":"WPE_HARD","hard_soft":"HARD","horizon":"CURRENT_MARKET","adoption":"PARITY","priority":"P0_PARITY"},{"id":"relations.integrity.endpoint_validation","feature_group":"Integrity","option_path":"integrity.endpoint_validation","label":"Endpoint Type / Subtype Validation","classification":"WPE_HARD","hard_soft":"HARD","horizon":"CURRENT_MARKET","adoption":"PARITY","priority":"P0_PARITY"},{"id":"relations.integrity.permissions_validation","feature_group":"Integrity","option_path":"integrity.permissions_validation","label":"Permission Validation Before Edge Mutation","classification":"WPE_HARD","hard_soft":"HARD","horizon":"CURRENT_MARKET","adoption":"PARITY","priority":"P0_PARITY"},{"id":"relations.integrity.transactional_mutation","feature_group":"Integrity","option_path":"integrity.transactional_mutation","label":"Atomic Relation Edge Mutation","classification":"WPE_EXCEED","hard_soft":"HYBRID","horizon":"WPE_FUTURE","adoption":"WPE_EXCEED","priority":"P1_EXCEED"},{"id":"relations.integrity.double_writer_guard","feature_group":"Integrity","option_path":"integrity.double_writer_guard","label":"No Ambiguous Double-writer Association Model","classification":"WPE_EXCEED","hard_soft":"HARD","horizon":"WPE_FUTURE","adoption":"WPE_EXCEED","priority":"P1_EXCEED"},{"id":"relations.integrity.reciprocal_consistency","feature_group":"Integrity","option_path":"integrity.reciprocal_consistency","label":"Reciprocal Edge Consistency Check","classification":"WPE_EXCEED","hard_soft":"HARD","horizon":"WPE_FUTURE","adoption":"WPE_EXCEED","priority":"P1_EXCEED"},{"id":"relations.integrity.edge_health","feature_group":"Integrity","option_path":"integrity.edge_health","label":"Relation Edge Health Scanner","classification":"WPE_EXCEED","hard_soft":"HARD","horizon":"WPE_FUTURE","adoption":"WPE_EXCEED","priority":"P1_EXCEED"},{"id":"relations.observability.count_metrics","feature_group":"Observability","option_path":"observability.count_metrics","label":"Relation Count Metrics","classification":"WPE_EXCEED","hard_soft":"HARD","horizon":"WPE_FUTURE","adoption":"WPE_EXCEED","priority":"P1_EXCEED"},{"id":"relations.observability.slow_query_trace","feature_group":"Observability","option_path":"observability.slow_query_trace","label":"Slow Relation Query Trace","classification":"WPE_EXCEED","hard_soft":"HARD","horizon":"WPE_FUTURE","adoption":"WPE_EXCEED","priority":"P1_EXCEED"},{"id":"relations.extensibility.endpoint_adapter","feature_group":"Extensibility","option_path":"extensibility.endpoint_adapter","label":"Registered Endpoint Adapter","classification":"PROVIDER_SOFT","hard_soft":"HYBRID","horizon":"CURRENT_MARKET","adoption":"PROVIDER","priority":"P1_CORE"},{"id":"relations.extensibility.storage_adapter","feature_group":"Extensibility","option_path":"extensibility.storage_adapter","label":"Registered Relation Storage Adapter","classification":"PROVIDER_SOFT","hard_soft":"HYBRID","horizon":"CURRENT_MARKET","adoption":"PROVIDER","priority":"P1_CORE"}],"coverage":{"records":26,"unreviewed":0,"adopted_or_classified":26,"notes":"Relation frontend forms/listings, portability, migration, performance, integrity, observability and extensibility."}}