{
  "schema_version":1,"bank_version":"v1","surface":{"id":17,"key":"forms-workflows","name":"Forms & Workflows"},
  "snapshot":{"date":"2026-09-12","native_sources":[
    {"name":"wp_verify_nonce()","type":"wordpress_core","url":"https://developer.wordpress.org/reference/functions/wp_verify_nonce/","verified":true,"notes":"Nonce verification is CSRF/request-intent protection, not authorization."},
    {"name":"check_admin_referer()","type":"wordpress_core","url":"https://developer.wordpress.org/reference/functions/check_admin_referer/","verified":true},
    {"name":"admin_post_{$action}","type":"wordpress_core","url":"https://developer.wordpress.org/reference/hooks/admin_post_action/","verified":true},
    {"name":"WordPress AJAX","type":"wordpress_handbook","url":"https://developer.wordpress.org/plugins/javascript/ajax/","verified":true},
    {"name":"REST API custom endpoints","type":"wordpress_handbook","url":"https://developer.wordpress.org/rest-api/extending-the-rest-api/adding-custom-endpoints/","verified":true,"notes":"REST mutations require an explicit permission_callback."},
    {"name":"Roles & Capabilities","type":"wordpress_handbook","url":"https://developer.wordpress.org/apis/security/user-roles-and-capabilities/","verified":true}
  ],"market_sources":[]},"status":"BANK_SURFACE_SEEDED",
  "records":[
    {"id":"forms-workflows.form.identity","feature_group":"Form Identity","option_path":"form.identity","label":"Form Identity / Lifecycle / Revisions","classification":"WPE_HARD","hard_soft":"HARD","horizon":"CURRENT_MARKET","adoption":"UNREVIEWED","priority":"P1_CORE","notes":"WordPress core has no generic form-definition lifecycle."},
    {"id":"forms-workflows.form.layout","feature_group":"Form Identity","option_path":"form.layout","label":"Steps / Sections / Layout","classification":"WPE_HARD","hard_soft":"SOFT","horizon":"CURRENT_MARKET","adoption":"UNREVIEWED","priority":"P1_CORE"},
    {"id":"forms-workflows.controls.registry","feature_group":"Controls & Validation","option_path":"controls.registry","label":"Field Registry Controls / Prefill","classification":"WPE_HARD","hard_soft":"HARD","horizon":"CURRENT_MARKET","adoption":"UNREVIEWED","priority":"P1_CORE","notes":"Control schema remains Fields-owned; native request/HTML primitives do not create a form control registry."},
    {"id":"forms-workflows.controls.validation","feature_group":"Controls & Validation","option_path":"controls.validation","label":"Validation / Server-Authoritative Calculations","classification":"WPE_HARD","hard_soft":"HARD","horizon":"CURRENT_MARKET","adoption":"UNREVIEWED","priority":"P1_CORE","notes":"Server validation is authoritative; native sanitization/request primitives are substrate, not a generic validation graph."},
    {"id":"forms-workflows.submission.policy","feature_group":"Submission","option_path":"submission.policy","label":"Submission / Rate Limit / Duplicate Policy","classification":"WPE_HARD","hard_soft":"HARD","horizon":"CURRENT_MARKET","adoption":"UNREVIEWED","priority":"P1_CORE","notes":"Nonce/session/capability/permission-callback checks are native security substrate. A nonce never equals authentication or authorization."},
    {"id":"forms-workflows.submission.confirmation","feature_group":"Submission","option_path":"submission.confirmation","label":"Confirmation Behavior","classification":"WPE_HARD","hard_soft":"SOFT","horizon":"CURRENT_MARKET","adoption":"UNREVIEWED","priority":"P1_CORE"},
    {"id":"forms-workflows.entry.storage-retention","feature_group":"Entries","option_path":"entry.storage_retention","label":"Entry Storage / Retention / Privacy","classification":"WPE_HARD","hard_soft":"HARD","horizon":"CURRENT_MARKET","adoption":"UNREVIEWED","priority":"P1_CORE","notes":"WordPress storage APIs do not define a canonical form-entry model."},
    {"id":"forms-workflows.entry.management","feature_group":"Entries","option_path":"entry.management","label":"Notes / Assignment / Export / Anonymization","classification":"WPE_HARD","hard_soft":"SOFT","horizon":"CURRENT_MARKET","adoption":"UNREVIEWED","priority":"P1_CORE"},
    {"id":"forms-workflows.workflow.owner-order","feature_group":"Workflow Actions","option_path":"workflow.owner_order","label":"Canonical Action Owner / Ordering","classification":"WPE_HARD","hard_soft":"HARD","horizon":"CURRENT_MARKET","adoption":"UNREVIEWED","priority":"P1_CORE","notes":"Actions reference registered Abilities/providers; native hooks are not user-authored executable configuration."},
    {"id":"forms-workflows.workflow.conditions-mapping","feature_group":"Workflow Actions","option_path":"workflow.conditions_mapping","label":"Conditions / Data Mapping","classification":"WPE_HARD","hard_soft":"HARD","horizon":"CURRENT_MARKET","adoption":"UNREVIEWED","priority":"P1_CORE"},
    {"id":"forms-workflows.workflow.failure","feature_group":"Workflow Actions","option_path":"workflow.failure","label":"Timeout / Retry / Failure / Compensation","classification":"WPE_HARD","hard_soft":"HARD","horizon":"CURRENT_MARKET","adoption":"UNREVIEWED","priority":"P1_CORE"},
    {"id":"forms-workflows.run.state","feature_group":"Run State","option_path":"run.state","label":"Run State / Checkpoints / Resume / Cancel","classification":"WPE_HARD","hard_soft":"HARD","horizon":"CURRENT_MARKET","adoption":"UNREVIEWED","priority":"P1_CORE"},
    {"id":"forms-workflows.run.replay","feature_group":"Run State","option_path":"run.replay","label":"Correlation / Replay Protection","classification":"WPE_HARD","hard_soft":"HARD","horizon":"CURRENT_MARKET","adoption":"UNREVIEWED","priority":"P1_CORE"},
    {"id":"forms-workflows.integration.payment","feature_group":"Integrations","option_path":"integration.payment","label":"Payment Provider Mapping","classification":"PROVIDER_SOFT","hard_soft":"HYBRID","horizon":"CURRENT_MARKET","adoption":"UNREVIEWED","priority":"P2_COMPETITIVE"},
    {"id":"forms-workflows.integration.ability-secret","feature_group":"Integrations","option_path":"integration.ability_secret","label":"Registered Ability / Vault Secret Reference","classification":"WPE_HARD","hard_soft":"HARD","horizon":"CURRENT_MARKET","adoption":"UNREVIEWED","priority":"P1_CORE"},
    {"id":"forms-workflows.safety.raw-executable","feature_group":"Safety","option_path":"safety.raw_executable","label":"Raw Executable Workflow Input","classification":"REJECTED_UNSAFE","hard_soft":"HARD","horizon":"CURRENT_MARKET","adoption":"REJECT","priority":"NOT_SCHEDULED"},
    {"id":"forms-workflows.submission.invocation-channel","feature_group":"Submission","option_path":"submission.invocation_channel","label":"Registered Admin-Post / AJAX / REST Invocation Channel","classification":"SOFT_NATIVE","hard_soft":"HYBRID","horizon":"CURRENT_NATIVE","adoption":"MUST_HAVE","priority":"P0_NATIVE","native_source":{"api":"admin-post/AJAX/REST","key":"registered_operation_identity","internal":false},"notes":"Captures authenticated/public scope, REST route/method/schema and permission policy, nonce/session requirements and canonical target Ability. Raw hook names/callbacks remain forbidden."}
  ],
  "coverage":{"records":17,"unreviewed":15,"adopted_or_classified":2,"notes":"Native request/security invocation channels are integrated without inventing a WordPress workflow engine. Workflow/run/retry/conditions/payment semantics remain WPE/provider/market review concerns; raw executable input stays rejected."}
}
