{
  "schema_version":1,
  "bank_version":"v1",
  "surface":{"id":11,"key":"admin-menu","name":"Admin Menu"},
  "snapshot":{"date":"2026-09-13","native_sources":[
    {"name":"add_menu_page()","type":"wordpress_core","url":"https://developer.wordpress.org/reference/functions/add_menu_page/","verified":true},
    {"name":"add_submenu_page()","type":"wordpress_core","url":"https://developer.wordpress.org/reference/functions/add_submenu_page/","verified":true},
    {"name":"remove_menu_page()","type":"wordpress_core","url":"https://developer.wordpress.org/reference/functions/remove_menu_page/","verified":true},
    {"name":"remove_submenu_page()","type":"wordpress_core","url":"https://developer.wordpress.org/reference/functions/remove_submenu_page/","verified":true},
    {"name":"admin_menu","type":"wordpress_core","url":"https://developer.wordpress.org/reference/hooks/admin_menu/","verified":true},
    {"name":"user_admin_menu","type":"wordpress_core","url":"https://developer.wordpress.org/reference/hooks/user_admin_menu/","verified":true},
    {"name":"network_admin_menu","type":"wordpress_core","url":"https://developer.wordpress.org/reference/hooks/network_admin_menu/","verified":true},
    {"name":"WP_Admin_Bar::add_node()","type":"wordpress_core","url":"https://developer.wordpress.org/reference/classes/wp_admin_bar/add_node/","verified":true}
  ],"market_sources":[
    {"name":"Admin Menu Editor Pro","type":"official_competitor","url":"https://adminmenueditor.com/home/","verified":true},
    {"name":"WP Adminify Admin Menu Editor","type":"official_competitor","url":"https://wpadminify.com/features/admin-menu-editor","verified":true},
    {"name":"Ultimate Dashboard PRO Admin Menu Editor","type":"official_competitor","url":"https://ultimatedashboard.io/docs/admin-menu-editor/","verified":true}
  ]},
  "status":"BANK_SURFACE_SEEDED",
  "records":[
    {"id":"admin-menu.transform.target","feature_group":"Transformation Rule","option_path":"transform.target","label":"Target Original Menu/Submenu","classification":"NATIVE_HARD","hard_soft":"HARD","horizon":"CURRENT_NATIVE","adoption":"MUST_HAVE","priority":"P0_NATIVE","native_source":{"api":"add_menu_page/add_submenu_page","key":"menu_slug,parent_slug","internal":false},"notes":"Native slug/parent identity is the target substrate; transformations still require missing-target diagnostics."},
    {"id":"admin-menu.transform.rename","feature_group":"Transformation Rule","option_path":"transform.rename","label":"Rename Menu Item","classification":"WPE_HARD","hard_soft":"SOFT","horizon":"CURRENT_MARKET","adoption":"PARITY","priority":"P0_PARITY","notes":"Rename is established market parity across reviewed admin-menu editors."},
    {"id":"admin-menu.transform.order","feature_group":"Transformation Rule","option_path":"transform.order","label":"Menu Order","classification":"SOFT_NATIVE","hard_soft":"SOFT","horizon":"CURRENT_NATIVE","adoption":"MUST_HAVE","priority":"P0_NATIVE","native_source":{"api":"add_menu_page","key":"position","internal":false},"notes":"Native position/order substrate; deterministic conflict diagnostics remain WPE-owned."},
    {"id":"admin-menu.transform.parent","feature_group":"Transformation Rule","option_path":"transform.parent","label":"Parent Reassignment","classification":"NATIVE_HARD","hard_soft":"HARD","horizon":"CURRENT_NATIVE","adoption":"MUST_HAVE","priority":"P0_NATIVE","native_source":{"api":"add_submenu_page","key":"parent_slug","internal":false},"notes":"Native parent identity is confirmed; moving pre-existing third-party items remains a bounded WPE transform."},
    {"id":"admin-menu.transform.visibility","feature_group":"Transformation Rule","option_path":"transform.visibility","label":"Hide/Show Presentation Rule","classification":"NATIVE_HARD","hard_soft":"HARD","horizon":"CURRENT_NATIVE","adoption":"MUST_HAVE","priority":"P0_NATIVE","native_source":{"api":"remove_menu_page/remove_submenu_page","key":"menu_slug,submenu_slug","internal":false},"notes":"Presentation visibility never grants or revokes authorization for the target operation."},
    {"id":"admin-menu.transform.role-capability","feature_group":"Visibility","option_path":"transform.role_capability","label":"Role / Capability Visibility References","classification":"WPE_HARD","hard_soft":"HARD","horizon":"CURRENT_MARKET","adoption":"PARITY","priority":"P0_PARITY","notes":"Role/capability targeting is market parity, but effective role/capability truth belongs to Surface 30 / Policy."},
    {"id":"admin-menu.transform.network","feature_group":"Visibility","option_path":"transform.network","label":"Site / User Admin / Network Admin Context Visibility","classification":"NATIVE_HARD","hard_soft":"HARD","horizon":"CURRENT_NATIVE","adoption":"MUST_HAVE","priority":"P0_NATIVE","native_source":{"api":"admin_menu/user_admin_menu/network_admin_menu","key":"admin_context","internal":false},"notes":"Site, user-admin and network-admin are distinct contexts; Super Admin is an authorization caveat, not a context substitute."},
    {"id":"admin-menu.custom.route","feature_group":"Custom Menu Item","option_path":"custom.route","label":"Internal WPE Route","classification":"WPE_HARD","hard_soft":"HARD","horizon":"CURRENT_MARKET","adoption":"PARITY","priority":"P0_PARITY","notes":"Custom items are market parity; WPE exposes registered internal routes only, never arbitrary executable callbacks."},
    {"id":"admin-menu.custom.safe-url","feature_group":"Custom Menu Item","option_path":"custom.safe_url","label":"Validated Admin / External URL","classification":"WPE_HARD","hard_soft":"HARD","horizon":"CURRENT_MARKET","adoption":"PARITY","priority":"P0_PARITY","notes":"Custom URLs are market parity while scheme/host validation remains a WPE safety boundary."},
    {"id":"admin-menu.custom.group","feature_group":"Custom Menu Item","option_path":"custom.group","label":"Separator / Group / Submenu Composition","classification":"WPE_HARD","hard_soft":"SOFT","horizon":"CURRENT_MARKET","adoption":"PARITY","priority":"P0_PARITY","notes":"Separators, groups and submenu composition are established market capabilities."},
    {"id":"admin-menu.profile.definition","feature_group":"Profiles","option_path":"profile.definition","label":"Named Menu Profile","classification":"WPE_HARD","hard_soft":"HARD","horizon":"CURRENT_MARKET","adoption":"COMPETITIVE","priority":"P2_COMPETITIVE","notes":"Named portable menu profiles remain a WPE composition layer beyond the reviewed universal market baseline."},
    {"id":"admin-menu.profile.assignment","feature_group":"Profiles","option_path":"profile.assignment","label":"Role / User / Site / Network Assignment","classification":"WPE_HARD","hard_soft":"HARD","horizon":"CURRENT_MARKET","adoption":"PARITY","priority":"P0_PARITY","notes":"Per-role/per-user assignment is market parity; this surface stores bounded references only and does not own grants."},
    {"id":"admin-menu.profile.preview","feature_group":"Profiles","option_path":"profile.preview","label":"Preview as Role/User","classification":"WPE_HARD","hard_soft":"SOFT","horizon":"CURRENT_MARKET","adoption":"COMPETITIVE","priority":"P2_COMPETITIVE","notes":"Non-impersonating diagnostic preview remains a WPE differentiation with no account mutation."},
    {"id":"admin-menu.admin-bar.transform","feature_group":"Admin Bar","option_path":"admin_bar.transform","label":"Admin Bar Transform / Custom Item","classification":"SOFT_NATIVE","hard_soft":"SOFT","horizon":"CURRENT_NATIVE","adoption":"MUST_HAVE","priority":"P0_NATIVE","native_source":{"api":"WP_Admin_Bar::add_node","key":"id,parent,group,href,meta","internal":false},"notes":"Admin Bar node graph is native; arbitrary executable HTML/onclick is not an authored Bank capability."},
    {"id":"admin-menu.safety.recovery","feature_group":"Safety","option_path":"safety.recovery","label":"Recovery Route / Missing Target / Conflict Handling","classification":"WPE_HARD","hard_soft":"HARD","horizon":"CURRENT_MARKET","adoption":"PARITY","priority":"P0_PARITY","notes":"Recovery/import-export exists in reviewed products; WPE retains deterministic missing-target and conflict diagnostics."},
    {"id":"admin-menu.safety.unsafe-url","feature_group":"Safety","option_path":"safety.unsafe_url","label":"Unsafe URL Scheme","classification":"REJECTED_UNSAFE","hard_soft":"HARD","horizon":"CURRENT_MARKET","adoption":"REJECT","priority":"NOT_SCHEDULED","notes":"Market custom-link flexibility does not justify executable or unsafe URL schemes."}
  ],
  "coverage":{"records":16,"unreviewed":0,"adopted_or_classified":16,"notes":"Native and current market evidence now reconcile all 16 records. Transform/custom-item/assignment/recovery families are market-classified, named profiles/preview remain WPE competitive composition, authorization remains Roles/Policy-owned, and unsafe URLs stay rejected."}
}
