{
  "schema_version":1,"bank_version":"v1","surface":{"id":3,"key":"fields","name":"Fields / Field Groups"},
  "snapshot":{"date":"2026-08-31","native_sources":[],"market_sources":[{"name":"ACF","type":"official_competitor","url":"https://www.advancedcustomfields.com/resources/","verified":true},{"name":"Secure Custom Fields","type":"wordpress_handbook","url":"https://developer.wordpress.org/secure-custom-fields/features/","verified":true},{"name":"Meta Box","type":"official_competitor","url":"https://docs.metabox.io/","verified":true},{"name":"JetEngine","type":"official_competitor","url":"https://crocoblock.com/knowledge-base/jetengine/","verified":true},{"name":"Redux Framework","type":"official_competitor","url":"https://docsv3.redux.io/","verified":true}]},
  "status":"BANK_SURFACE_SEEDED",
  "records":[
    {"id":"fields.compat_acf_import","feature_group":"Compatibility","option_path":"compat.acf_import","label":"ACF Field Group Import Adapter","classification":"COMPATIBILITY","hard_soft":"SOFT","horizon":"CURRENT_MARKET","adoption":"COMPETITIVE","priority":"P2_COMPETITIVE"},
    {"id":"fields.compat_scf_import","feature_group":"Compatibility","option_path":"compat.scf_import","label":"SCF Field Group Import Adapter","classification":"COMPATIBILITY","hard_soft":"SOFT","horizon":"CURRENT_MARKET","adoption":"COMPETITIVE","priority":"P2_COMPETITIVE"},
    {"id":"fields.compat_metabox_import","feature_group":"Compatibility","option_path":"compat.metabox_import","label":"Meta Box Field Group Import Adapter","classification":"COMPATIBILITY","hard_soft":"SOFT","horizon":"CURRENT_MARKET","adoption":"COMPETITIVE","priority":"P2_COMPETITIVE"},
    {"id":"fields.compat_jetengine_import","feature_group":"Compatibility","option_path":"compat.jetengine_import","label":"JetEngine Meta Field Import Adapter","classification":"COMPATIBILITY","hard_soft":"SOFT","horizon":"CURRENT_MARKET","adoption":"COMPETITIVE","priority":"P2_COMPETITIVE"},
    {"id":"fields.compat_redux_import","feature_group":"Compatibility","option_path":"compat.redux_import","label":"Redux Control Import Adapter","classification":"COMPATIBILITY","hard_soft":"SOFT","horizon":"CURRENT_MARKET","adoption":"COMPETITIVE","priority":"P2_COMPETITIVE"},
    {"id":"fields.exceed_schema_diff","feature_group":"Diagnostics","option_path":"exceed.schema_diff","label":"Field Schema Diff Preview","classification":"WPE_EXCEED","hard_soft":"SOFT","horizon":"WPE_FUTURE","adoption":"WPE_EXCEED","priority":"P1_EXCEED"},
    {"id":"fields.exceed_usage_graph","feature_group":"Diagnostics","option_path":"exceed.usage_graph","label":"Field Usage & Dependency Graph","classification":"WPE_EXCEED","hard_soft":"SOFT","horizon":"WPE_FUTURE","adoption":"WPE_EXCEED","priority":"P1_EXCEED"},
    {"id":"fields.exceed_storage_preview","feature_group":"Diagnostics","option_path":"exceed.storage_preview","label":"Effective Storage Preview","classification":"WPE_EXCEED","hard_soft":"SOFT","horizon":"WPE_FUTURE","adoption":"WPE_EXCEED","priority":"P1_EXCEED"},
    {"id":"fields.exceed_queryability","feature_group":"Diagnostics","option_path":"exceed.queryability","label":"Queryability Diagnostic","classification":"WPE_EXCEED","hard_soft":"SOFT","horizon":"WPE_FUTURE","adoption":"WPE_EXCEED","priority":"P1_EXCEED"},
    {"id":"fields.exceed_index_recommendation","feature_group":"Diagnostics","option_path":"exceed.index_recommendation","label":"Index Recommendation","classification":"WPE_EXCEED","hard_soft":"SOFT","horizon":"WPE_FUTURE","adoption":"WPE_EXCEED","priority":"P1_EXCEED"},
    {"id":"fields.exceed_performance_budget","feature_group":"Diagnostics","option_path":"exceed.performance_budget","label":"Field Group Performance Budget","classification":"WPE_EXCEED","hard_soft":"SOFT","horizon":"WPE_FUTURE","adoption":"WPE_EXCEED","priority":"P1_EXCEED"},
    {"id":"fields.exceed_nesting_warning","feature_group":"Diagnostics","option_path":"exceed.nesting_warning","label":"Nested Structure Complexity Warning","classification":"WPE_EXCEED","hard_soft":"SOFT","horizon":"WPE_FUTURE","adoption":"WPE_EXCEED","priority":"P1_EXCEED"},
    {"id":"fields.exceed_migration_plan","feature_group":"Migration","option_path":"exceed.migration_plan","label":"Schema Migration Plan","classification":"WPE_EXCEED","hard_soft":"HYBRID","horizon":"WPE_FUTURE","adoption":"WPE_EXCEED","priority":"P1_EXCEED"},
    {"id":"fields.exceed_rollback","feature_group":"Migration","option_path":"exceed.rollback","label":"Field Schema Rollback","classification":"WPE_EXCEED","hard_soft":"HYBRID","horizon":"WPE_FUTURE","adoption":"WPE_EXCEED","priority":"P1_EXCEED"},
    {"id":"fields.exceed_presets","feature_group":"Productivity","option_path":"exceed.presets","label":"Field Schema Presets","classification":"WPE_EXCEED","hard_soft":"SOFT","horizon":"WPE_FUTURE","adoption":"WPE_EXCEED","priority":"P1_EXCEED"},
    {"id":"fields.exceed_ai_generate","feature_group":"AI & Productivity","option_path":"exceed.ai_generate","label":"AI-Assisted Field Schema Draft","classification":"WPE_EXCEED","hard_soft":"SOFT","horizon":"WPE_FUTURE","adoption":"WPE_EXCEED","priority":"P1_EXCEED"},
    {"id":"fields.exceed_ai_review","feature_group":"AI & Productivity","option_path":"exceed.ai_review","label":"Human Approval for AI Field Changes","classification":"WPE_EXCEED","hard_soft":"SOFT","horizon":"WPE_FUTURE","adoption":"WPE_EXCEED","priority":"P1_EXCEED"},
    {"id":"fields.exceed_search_settings","feature_group":"Admin UX","option_path":"exceed.search_settings","label":"Find Setting / Field Option Search","classification":"WPE_EXCEED","hard_soft":"SOFT","horizon":"WPE_FUTURE","adoption":"WPE_EXCEED","priority":"P1_EXCEED"},
    {"id":"fields.exceed_effective_contract","feature_group":"Diagnostics","option_path":"exceed.effective_contract","label":"Effective Field Contract Preview","classification":"WPE_EXCEED","hard_soft":"SOFT","horizon":"WPE_FUTURE","adoption":"WPE_EXCEED","priority":"P1_EXCEED"},
    {"id":"fields.exceed_roundtrip_test","feature_group":"Diagnostics","option_path":"exceed.roundtrip_test","label":"Field Round-Trip Test Harness","classification":"WPE_EXCEED","hard_soft":"SOFT","horizon":"WPE_FUTURE","adoption":"WPE_EXCEED","priority":"P1_EXCEED"}
  ],
  "coverage":{"records":20,"unreviewed":0,"adopted_or_classified":20,"notes":"Migration adapters and WPE exceed diagnostics/productivity possibilities for field schemas."}
}
