{"schema_version":1,"bank_version":"v1","surface":{"id":4,"key":"relations","name":"Relations"},"snapshot":{"date":"2026-09-01","native_sources":[{"name":"WordPress Object-Term Relationships","type":"wordpress_core","url":"https://developer.wordpress.org/reference/functions/wp_set_object_terms/","verified":true},{"name":"WordPress Post Parent Hierarchy","type":"wordpress_core","url":"https://developer.wordpress.org/reference/functions/get_post_parent/","verified":true}],"market_sources":[{"name":"JetEngine Relations","type":"official_competitor","url":"https://crocoblock.com/knowledge-base/features/relations-overview/","verified":true},{"name":"Meta Box Relationships","type":"official_competitor","url":"https://docs.metabox.io/extensions/mb-relationships/","verified":true},{"name":"ACF Bidirectional Relationships","type":"official_competitor","url":"https://www.advancedcustomfields.com/resources/bidirectional-relationships/","verified":true},{"name":"Pods Relationship Field","type":"official_competitor","url":"https://docs.pods.io/fields/relationship/","verified":true},{"name":"Toolset Post Relationships","type":"official_competitor","url":"https://toolset.com/glossary/post-relationships/","verified":true},{"name":"ACPT Relational Field","type":"official_competitor","url":"https://docs.acpt.io/meta-fields/field-types/relational-field","verified":true}]},"status":"BANK_SURFACE_SEEDED","records":[{"id":"relations.query.enabled","feature_group":"Query Integration","option_path":"query.enabled","label":"Relation Query Integration Enabled","classification":"WPE_HARD","hard_soft":"HARD","horizon":"CURRENT_MARKET","adoption":"PARITY","priority":"P0_PARITY"},{"id":"relations.query.direction","feature_group":"Query Integration","option_path":"query.direction","label":"Query Direction","classification":"WPE_HARD","hard_soft":"HARD","horizon":"CURRENT_MARKET","adoption":"PARITY","priority":"P0_PARITY","allowed_values":["from","to","either","siblings"]},{"id":"relations.query.related_ids","feature_group":"Query Integration","option_path":"query.related_ids","label":"Resolve Related IDs","classification":"WPE_HARD","hard_soft":"HARD","horizon":"CURRENT_MARKET","adoption":"PARITY","priority":"P0_PARITY"},{"id":"relations.query.related_objects","feature_group":"Query Integration","option_path":"query.related_objects","label":"Resolve Related Objects","classification":"WPE_HARD","hard_soft":"HARD","horizon":"CURRENT_MARKET","adoption":"PARITY","priority":"P0_PARITY"},{"id":"relations.query.siblings","feature_group":"Query Integration","option_path":"query.siblings","label":"Query Sibling Objects","classification":"WPE_HARD","hard_soft":"HARD","horizon":"CURRENT_MARKET","adoption":"COMPETITIVE","priority":"P2_COMPETITIVE"},{"id":"relations.query.count","feature_group":"Query Integration","option_path":"query.count","label":"Relation Count Query","classification":"WPE_HARD","hard_soft":"HARD","horizon":"CURRENT_MARKET","adoption":"PARITY","priority":"P0_PARITY"},{"id":"relations.query.exists","feature_group":"Query Integration","option_path":"query.exists","label":"Relation Exists Predicate","classification":"WPE_HARD","hard_soft":"HARD","horizon":"CURRENT_MARKET","adoption":"PARITY","priority":"P0_PARITY"},{"id":"relations.query.pivot_filter","feature_group":"Query Integration","option_path":"query.pivot_filter","label":"Pivot Metadata Filter","classification":"WPE_HARD","hard_soft":"HARD","horizon":"CURRENT_MARKET","adoption":"COMPETITIVE","priority":"P2_COMPETITIVE"},{"id":"relations.query.order_by_edge","feature_group":"Query Integration","option_path":"query.order_by_edge","label":"Order By Edge Position","classification":"WPE_HARD","hard_soft":"HARD","horizon":"CURRENT_MARKET","adoption":"COMPETITIVE","priority":"P2_COMPETITIVE"},{"id":"relations.query.order_by_pivot","feature_group":"Query Integration","option_path":"query.order_by_pivot","label":"Order By Pivot Metadata","classification":"WPE_HARD","hard_soft":"HARD","horizon":"CURRENT_MARKET","adoption":"COMPETITIVE","priority":"P2_COMPETITIVE"},{"id":"relations.query.pagination","feature_group":"Query Integration","option_path":"query.pagination","label":"Related-item Pagination","classification":"WPE_HARD","hard_soft":"HARD","horizon":"CURRENT_MARKET","adoption":"PARITY","priority":"P0_PARITY"},{"id":"relations.query.cache","feature_group":"Performance","option_path":"query.cache","label":"Relation Query Cache Policy","classification":"WPE_EXCEED","hard_soft":"HARD","horizon":"WPE_FUTURE","adoption":"WPE_EXCEED","priority":"P1_EXCEED"},{"id":"relations.query.ast_provider","feature_group":"Query Integration","option_path":"query.ast_provider","label":"Relation-aware Query AST Provider","classification":"WPE_EXCEED","hard_soft":"HYBRID","horizon":"WPE_FUTURE","adoption":"WPE_EXCEED","priority":"P1_EXCEED"},{"id":"relations.api.rest.expose","feature_group":"REST / API","option_path":"api.rest.expose","label":"Expose Relation In REST API","classification":"WPE_HARD","hard_soft":"HARD","horizon":"CURRENT_MARKET","adoption":"PARITY","priority":"P0_PARITY"},{"id":"relations.api.rest.read","feature_group":"REST / API","option_path":"api.rest.read","label":"REST Read Related Items","classification":"WPE_HARD","hard_soft":"HARD","horizon":"CURRENT_MARKET","adoption":"PARITY","priority":"P0_PARITY"},{"id":"relations.api.rest.connect","feature_group":"REST / API","option_path":"api.rest.connect","label":"REST Connect Edge","classification":"WPE_HARD","hard_soft":"HARD","horizon":"CURRENT_MARKET","adoption":"COMPETITIVE","priority":"P2_COMPETITIVE"},{"id":"relations.api.rest.disconnect","feature_group":"REST / API","option_path":"api.rest.disconnect","label":"REST Disconnect Edge","classification":"WPE_HARD","hard_soft":"HARD","horizon":"CURRENT_MARKET","adoption":"COMPETITIVE","priority":"P2_COMPETITIVE"},{"id":"relations.api.rest.exists","feature_group":"REST / API","option_path":"api.rest.exists","label":"REST Edge Existence Check","classification":"WPE_HARD","hard_soft":"HARD","horizon":"CURRENT_MARKET","adoption":"COMPETITIVE","priority":"P2_COMPETITIVE"},{"id":"relations.api.rest.pivot","feature_group":"REST / API","option_path":"api.rest.pivot","label":"REST Pivot Metadata","classification":"WPE_HARD","hard_soft":"HARD","horizon":"CURRENT_MARKET","adoption":"COMPETITIVE","priority":"P2_COMPETITIVE"},{"id":"relations.api.rest.namespace","feature_group":"REST / API","option_path":"api.rest.namespace","label":"Relation REST Namespace","classification":"WPE_HARD","hard_soft":"HARD","horizon":"CURRENT_MARKET","adoption":"COMPETITIVE","priority":"P2_COMPETITIVE"},{"id":"relations.api.ability.expose","feature_group":"Abilities","option_path":"api.ability.expose","label":"Expose Relation Abilities","classification":"WPE_EXCEED","hard_soft":"HARD","horizon":"WPE_FUTURE","adoption":"WPE_EXCEED","priority":"P1_EXCEED"},{"id":"relations.api.graphql.adapter","feature_group":"Compatibility","option_path":"api.graphql.adapter","label":"GraphQL Relation Adapter","classification":"PROVIDER_SOFT","hard_soft":"HYBRID","horizon":"CURRENT_MARKET","adoption":"PROVIDER","priority":"P1_CORE"},{"id":"relations.frontend.read","feature_group":"Frontend","option_path":"frontend.read","label":"Frontend Relation Display","classification":"WPE_HARD","hard_soft":"HARD","horizon":"CURRENT_MARKET","adoption":"PARITY","priority":"P0_PARITY"},{"id":"relations.frontend.edit","feature_group":"Frontend","option_path":"frontend.edit","label":"Frontend Relation Editing","classification":"WPE_HARD","hard_soft":"HARD","horizon":"CURRENT_MARKET","adoption":"COMPETITIVE","priority":"P2_COMPETITIVE"},{"id":"relations.frontend.form_connect","feature_group":"Frontend","option_path":"frontend.form_connect","label":"Frontend Form Connect Operation","classification":"WPE_HARD","hard_soft":"HARD","horizon":"CURRENT_MARKET","adoption":"COMPETITIVE","priority":"P2_COMPETITIVE"}],"coverage":{"records":25,"unreviewed":0,"adopted_or_classified":25,"notes":"Relation query, REST/API/Abilities/GraphQL and frontend-read/edit capabilities."}}