{"schema_version":1,"bank_version":"v1","surface":{"id":10,"key":"dashboard-widgets","name":"Dashboard Widgets"},"snapshot":{"date":"2026-09-01","native_sources":[{"name":"WordPress Dashboard Widgets API","type":"wordpress_handbook","url":"https://developer.wordpress.org/apis/dashboard-widgets/","verified":true},{"name":"wp_add_dashboard_widget()","type":"wordpress_core","url":"https://developer.wordpress.org/reference/functions/wp_add_dashboard_widget/","verified":true}],"market_sources":[{"name":"Ultimate Dashboard","type":"official_competitor","url":"https://ultimatedashboard.io/docs/","verified":true},{"name":"WP Adminify Custom Dashboard Widgets","type":"official_competitor","url":"https://wpadminify.com/docs/adminify/productivity/create-custom-dashboard-widget","verified":true}]},"status":"BANK_SURFACE_SEEDED","records":[{"id":"dashboard-widgets.future.realtime_streaming","feature_group":"Future","option_path":"widget.future.realtime_streaming","label":"Real-Time Streaming Widget Updates","classification":"DEFERRED","hard_soft":"SOFT","horizon":"WPE_FUTURE","adoption":"LATER","priority":"P3_LATER","notes":"Deferred until shared realtime/event delivery contracts are certified; ordinary dashboard refresh must not create a private transport engine."},{"id":"dashboard-widgets.future.cross_network_federation","feature_group":"Future","option_path":"widget.future.cross_network_federation","label":"Cross-Network Dashboard Federation","classification":"DEFERRED","hard_soft":"SOFT","horizon":"WPE_FUTURE","adoption":"LATER","priority":"P3_LATER","notes":"Deferred; requires explicit multisite/network identity and remote trust contracts."}],"coverage":{"records":2,"unreviewed":0,"adopted_or_classified":2,"notes":"Explicitly deferred future capabilities split from the canonical WPE-exceed shard so Bank Review can enforce classification-specific policy consistency."}}