{"schema_version":1,"bank_version":"v1","surface":{"id":7,"key":"tables","name":"Custom Tables / Content Tables"},"snapshot":{"date":"2026-09-02","native_sources":[{"name":"WordPress Creating Tables with Plugins","type":"wordpress_handbook","url":"https://developer.wordpress.org/plugins/creating-tables-with-plugins/","verified":true},{"name":"WPE Custom Tables DDL Migration Language","type":"repository_source","url":"https://github.com/Vertex-Systems-Network/wpessential/blob/main/docs/ARCHITECTURE/CUSTOM-TABLES-DDL-MIGRATION-LANGUAGE.md","verified":true}],"market_sources":[{"name":"WooCommerce HPOS","type":"official_provider","url":"https://developer.woocommerce.com/docs/features/orders/high-performance-order-storage/","verified":true},{"name":"Meta Box MB Custom Table","type":"official_competitor","url":"https://docs.metabox.io/extensions/mb-custom-table/","verified":true},{"name":"JetEngine CCT","type":"official_competitor","url":"https://crocoblock.com/knowledge-base/features/custom-content-type/","verified":true},{"name":"Pods Advanced Content Types","type":"official_competitor","url":"https://docs.pods.io/learn/what-are-advanced-content-types/","verified":true}]},"status":"BANK_SURFACE_SEEDED","records":[{"id":"tables.index.redundancy_diagnostic","feature_group":"Diagnostics","option_path":"index.redundancy_diagnostic","label":"Redundant / Overlapping Index Diagnostic","classification":"WPE_EXCEED","hard_soft":"SOFT","horizon":"WPE_FUTURE","adoption":"WPE_EXCEED","priority":"P1_EXCEED"},{"id":"tables.index.selectivity_diagnostic","feature_group":"Diagnostics","option_path":"index.selectivity_diagnostic","label":"Index Selectivity Diagnostic","classification":"WPE_EXCEED","hard_soft":"SOFT","horizon":"WPE_FUTURE","adoption":"WPE_EXCEED","priority":"P1_EXCEED"},{"id":"tables.health.definition_state","feature_group":"Diagnostics","option_path":"health.definition_state","label":"Definition Health State","classification":"WPE_HARD","hard_soft":"HARD","horizon":"CURRENT_MARKET","adoption":"MUST_HAVE","priority":"P1_CORE"},{"id":"tables.health.physical_state","feature_group":"Diagnostics","option_path":"health.physical_state","label":"Physical Schema Health State","classification":"WPE_HARD","hard_soft":"HARD","horizon":"CURRENT_MARKET","adoption":"MUST_HAVE","priority":"P1_CORE"},{"id":"tables.health.drift_severity","feature_group":"Diagnostics","option_path":"health.drift_severity","label":"Schema Drift Severity","classification":"WPE_HARD","hard_soft":"HARD","horizon":"CURRENT_MARKET","adoption":"COMPETITIVE","priority":"P2_COMPETITIVE"},{"id":"tables.health.provider_capabilities","feature_group":"Diagnostics","option_path":"health.provider_capabilities","label":"DB Provider Capability State","classification":"COMPATIBILITY","hard_soft":"HYBRID","horizon":"CURRENT_MARKET","adoption":"COMPETITIVE","priority":"P2_COMPETITIVE"},{"id":"tables.performance.expected_rows","feature_group":"Performance","option_path":"performance.expected_rows","label":"Expected Row-volume Band","classification":"WPE_HARD","hard_soft":"SOFT","horizon":"CURRENT_MARKET","adoption":"PARITY","priority":"P0_PARITY"},{"id":"tables.performance.growth_rate","feature_group":"Performance","option_path":"performance.growth_rate","label":"Expected Growth Rate","classification":"WPE_HARD","hard_soft":"SOFT","horizon":"CURRENT_MARKET","adoption":"PARITY","priority":"P0_PARITY"},{"id":"tables.performance.row_size_estimate","feature_group":"Performance","option_path":"performance.row_size_estimate","label":"Estimated Row Size","classification":"WPE_EXCEED","hard_soft":"SOFT","horizon":"WPE_FUTURE","adoption":"WPE_EXCEED","priority":"P1_EXCEED"},{"id":"tables.performance.table_size_telemetry","feature_group":"Performance","option_path":"performance.table_size_telemetry","label":"Table Size Telemetry","classification":"WPE_EXCEED","hard_soft":"SOFT","horizon":"WPE_FUTURE","adoption":"WPE_EXCEED","priority":"P1_EXCEED"},{"id":"tables.performance.slow_query_diagnostic","feature_group":"Performance","option_path":"performance.slow_query_diagnostic","label":"Slow-query Diagnostic Integration","classification":"PROVIDER_SOFT","hard_soft":"HYBRID","horizon":"CURRENT_MARKET","adoption":"PROVIDER","priority":"P1_CORE"},{"id":"tables.performance.index_coverage_warning","feature_group":"Performance","option_path":"performance.index_coverage_warning","label":"Sort/filter Index Coverage Warning","classification":"WPE_EXCEED","hard_soft":"SOFT","horizon":"WPE_FUTURE","adoption":"WPE_EXCEED","priority":"P1_EXCEED"},{"id":"tables.retention.policy","feature_group":"Lifecycle","option_path":"retention.policy","label":"Retention Policy Integration","classification":"PROVIDER_SOFT","hard_soft":"HYBRID","horizon":"CURRENT_MARKET","adoption":"PROVIDER","priority":"P1_CORE"},{"id":"tables.cleanup.strategy","feature_group":"Lifecycle","option_path":"cleanup.strategy","label":"Cleanup Strategy Integration","classification":"PROVIDER_SOFT","hard_soft":"HYBRID","horizon":"CURRENT_MARKET","adoption":"PROVIDER","priority":"P1_CORE"},{"id":"tables.portability.definition_export","feature_group":"Portability","option_path":"portability.definition_export","label":"Portable Logical Definition Export","classification":"PROVIDER_SOFT","hard_soft":"HYBRID","horizon":"CURRENT_MARKET","adoption":"PROVIDER","priority":"P1_CORE"},{"id":"tables.portability.definition_import","feature_group":"Portability","option_path":"portability.definition_import","label":"Portable Logical Definition Import","classification":"PROVIDER_SOFT","hard_soft":"HYBRID","horizon":"CURRENT_MARKET","adoption":"PROVIDER","priority":"P1_CORE"},{"id":"tables.portability.data_export","feature_group":"Portability","option_path":"portability.data_export","label":"Bounded Data Export Integration","classification":"PROVIDER_SOFT","hard_soft":"HYBRID","horizon":"CURRENT_MARKET","adoption":"PROVIDER","priority":"P1_CORE"},{"id":"tables.portability.data_import","feature_group":"Portability","option_path":"portability.data_import","label":"Checkpointed Data Import Integration","classification":"PROVIDER_SOFT","hard_soft":"HYBRID","horizon":"CURRENT_MARKET","adoption":"PROVIDER","priority":"P1_CORE"},{"id":"tables.portability.unbounded_export","feature_group":"Portability","option_path":"portability.unbounded_export","label":"Unbounded Full-table Export via Request","classification":"REJECTED_UNSAFE","hard_soft":"HARD","horizon":"CURRENT_MARKET","adoption":"REJECT","priority":"NOT_SCHEDULED"},{"id":"tables.audit.definition_changes","feature_group":"Audit","option_path":"audit.definition_changes","label":"Definition Change Audit Integration","classification":"PROVIDER_SOFT","hard_soft":"HYBRID","horizon":"CURRENT_MARKET","adoption":"PROVIDER","priority":"P1_CORE"},{"id":"tables.audit.row_mutations","feature_group":"Audit","option_path":"audit.row_mutations","label":"Row Mutation Audit Integration","classification":"PROVIDER_SOFT","hard_soft":"HYBRID","horizon":"CURRENT_MARKET","adoption":"PROVIDER","priority":"P1_CORE"}],"coverage":{"records":21,"unreviewed":0,"adopted_or_classified":21,"notes":"Surface 7 planning shard; no runtime DDL/migration authorization."}}
